{
  "schema_version": "3.0.0",
  "repository_id": "repo:example/codex-governed-change",
  "candidate_id": "sha256:aaaaaaaaaaaaaaaaaaaaaaaaaaaaaaaaaaaaaaaaaaaaaaaaaaaaaaaaaaaaaaaa",
  "task_contract_sha256": "sha256:bbbbbbbbbbbbbbbbbbbbbbbbbbbbbbbbbbbbbbbbbbbbbbbbbbbbbbbbbbbbbbbb",
  "effective_policy_sha256": "sha256:cccccccccccccccccccccccccccccccccccccccccccccccccccccccccccccccc",
  "gate_manifest_sha256": "sha256:dddddddddddddddddddddddddddddddddddddddddddddddddddddddddddddddd",
  "context_receipt_sha256": "sha256:1111111111111111111111111111111111111111111111111111111111111111",
  "reviewer_prompt_sha256": "sha256:eeeeeeeeeeeeeeeeeeeeeeeeeeeeeeeeeeeeeeeeeeeeeeeeeeeeeeeeeeeeeeee",
  "qualification_id": "sha256:2222222222222222222222222222222222222222222222222222222222222222",
  "model": "gpt-5.6-sol",
  "invocation_id": "example-review-001",
  "verdict": "NO_BLOCKING_FINDING_OBSERVED",
  "reviewed_surfaces": [
    "exact_diff",
    "affected_closure",
    "governance_and_evidence"
  ],
  "affected_closure": [
    "docs/requirements.md",
    "tests/acceptance/test_blueprint_contract.py"
  ],
  "retrieval_expansions": [],
  "findings": [],
  "missing_evidence": [],
  "claims": [
    {
      "claim_id": "candidate_identity",
      "claim": "The blueprint quality gate passed for the supplied candidate",
      "classification": "DIRECTLY_OBSERVED",
      "evidence_refs": [
        {"locator_id": "sha256:3333333333333333333333333333333333333333333333333333333333333333", "sha256": "sha256:4444444444444444444444444444444444444444444444444444444444444444"}
      ]
    },
    {
      "claim_id": "required_gates",
      "claim": "No blocking defect was discovered in the reviewed surfaces",
      "classification": "VERIFIED_WITHIN_SCOPE",
      "evidence_refs": [
        {"locator_id": "sha256:5555555555555555555555555555555555555555555555555555555555555555", "sha256": "sha256:6666666666666666666666666666666666666666666666666666666666666666"}
      ]
    },
    {
      "claim_id": "affected_closure",
      "claim": "The exact protected affected closure was reviewed",
      "classification": "VERIFIED_WITHIN_SCOPE",
      "evidence_refs": [
        {"locator_id": "sha256:3333333333333333333333333333333333333333333333333333333333333333", "sha256": "sha256:4444444444444444444444444444444444444444444444444444444444444444"}
      ]
    },
    {
      "claim_id": "governance_integrity",
      "claim": "Protected governance authority was inspected",
      "classification": "VERIFIED_WITHIN_SCOPE",
      "evidence_refs": [
        {"locator_id": "sha256:5555555555555555555555555555555555555555555555555555555555555555", "sha256": "sha256:6666666666666666666666666666666666666666666666666666666666666666"}
      ]
    },
    {
      "claim_id": "evidence_reconstruction",
      "claim": "Relied-on evidence references were reconstructed",
      "classification": "VERIFIED_WITHIN_SCOPE",
      "evidence_refs": [
        {"locator_id": "sha256:3333333333333333333333333333333333333333333333333333333333333333", "sha256": "sha256:4444444444444444444444444444444444444444444444444444444444444444"}
      ]
    }
  ],
  "limitations": [
    "No blocking finding observed does not prove correctness or authorize merge"
  ]
}
